{
    "id": "profile-security-alert",
    "type": "scroll",
    "content": { "padding": "xl" },
    "subviews": [
        {
            "id": "root",
            "type": "vStack",
            "content": { "spacing": "l" },
            "subviews": [
                {
                    "id": "org-banner",
                    "type": "card",
                    "content": { "padding": "m" },
                    "subviews": [{
                        "id": "org-banner-row", "type": "hStack", "content": { "spacing": "m", "alignment": "center" },
                        "subviews": [
                            { "id": "org-icon", "type": "icon", "content": { "icon": "shieldCheck", "size": "large", "tint": "error" } },
                            {
                                "id": "org-text", "type": "vStack", "content": { "spacing": "xxs" },
                                "subviews": [
                                    { "id": "org-name", "type": "label", "content": { "text": "Deck", "textStyle": "headline" } },
                                    { "id": "org-type", "type": "label", "content": { "text": "Корпоративный аккаунт · Нарушение политики", "textStyle": "caption", "color": "error" } }
                                ]
                            }
                        ]
                    }]
                },
                {
                    "id": "alert-banner",
                    "type": "container",
                    "content": { "backgroundColor": "error", "padding": "m", "cornerRadius": "medium" },
                    "subviews": [
                        {
                            "id": "alert-row", "type": "hStack", "content": { "spacing": "m", "alignment": "center" },
                            "subviews": [
                                { "id": "alert-icon", "type": "icon", "content": { "icon": "error", "size": "large", "tint": "buttonDestructiveText" } },
                                {
                                    "id": "alert-text", "type": "vStack", "content": { "spacing": "xs" },
                                    "subviews": [
                                        { "id": "alert-title", "type": "label", "content": { "text": "Подозрительная активность", "textStyle": "headline", "color": "buttonDestructiveText" } },
                                        { "id": "alert-desc", "type": "label", "content": { "text": "Обнаружен вход с нового устройства из необычной локации. Подтвердите вашу личность.", "textStyle": "caption", "color": "buttonDestructiveText" } }
                                    ]
                                }
                            ]
                        }
                    ]
                },
                {
                    "id": "verify-card",
                    "type": "card",
                    "content": { "padding": "l" },
                    "subviews": [
                        {
                            "id": "verify-content", "type": "vStack", "content": { "spacing": "m", "alignment": "center" },
                            "subviews": [
                                { "id": "verify-icon", "type": "icon", "content": { "icon": "shieldCheck", "size": "large", "tint": "accent" } },
                                { "id": "verify-title", "type": "label", "content": { "text": "Требуется верификация", "textStyle": "headline", "alignment": "center" } },
                                { "id": "verify-desc", "type": "label", "content": { "text": "Для продолжения работы подтвердите вашу личность через email или TOTP-код", "textStyle": "callout", "color": "textSecondary", "alignment": "center" } },
                                {
                                    "id": "verify-btn", "type": "button",
                                    "content": { "title": "Отправить код подтверждения", "style": "primary" },
                                    "action": { "type": "alert", "payload": { "title": "Код отправлен", "message": "Код верификации отправлен на mkhavank@deck.lc.com" } }
                                }
                            ]
                        }
                    ]
                },
                {
                    "id": "profile-card",
                    "type": "card",
                    "content": { "padding": "xl" },
                    "subviews": [{
                        "id": "profile-info", "type": "vStack", "content": { "spacing": "s", "alignment": "center" },
                        "subviews": [
                            { "id": "avatar", "type": "icon", "content": { "icon": "profile", "size": "xlarge", "tint": "textSecondary" } },
                            { "id": "user-name", "type": "label", "content": { "text": "Матвей Хаванкин", "textStyle": "title1", "alignment": "center" } },
                            { "id": "user-email", "type": "label", "content": { "text": "mkhavank@deck.lc.com", "textStyle": "footnote", "color": "textSecondary", "alignment": "center" } },
                            { "id": "user-status", "type": "label", "content": { "text": "Статус: Ограничен", "textStyle": "caption", "color": "error", "alignment": "center" } }
                        ]
                    }]
                },
                { "id": "sep-1", "type": "divider" },
                { "id": "policy-header", "type": "label", "content": { "text": "Политика безопасности Deck", "textStyle": "headline" } },
                {
                    "id": "policy-card", "type": "card", "content": { "padding": "m" },
                    "subviews": [
                        {
                            "id": "policy-ip", "type": "hStack", "content": { "spacing": "m", "alignment": "center" },
                            "subviews": [
                                { "id": "p-ip-icon", "type": "icon", "content": { "icon": "lock", "size": "medium", "tint": "error" } },
                                {
                                    "id": "p-ip-info", "type": "vStack", "content": { "spacing": "xxs" },
                                    "subviews": [
                                        { "id": "p-ip-title", "type": "label", "content": { "text": "Geo-IP проверка", "textStyle": "body" } },
                                        { "id": "p-ip-status", "type": "label", "content": { "text": "Нарушение: вход из необычной локации", "textStyle": "caption", "color": "error" } }
                                    ]
                                }
                            ]
                        },
                        { "id": "p-div-1", "type": "divider" },
                        {
                            "id": "policy-device", "type": "hStack", "content": { "spacing": "m", "alignment": "center" },
                            "subviews": [
                                { "id": "p-dev-icon", "type": "icon", "content": { "icon": "error", "size": "medium", "tint": "error" } },
                                {
                                    "id": "p-dev-info", "type": "vStack", "content": { "spacing": "xxs" },
                                    "subviews": [
                                        { "id": "p-dev-title", "type": "label", "content": { "text": "Новое устройство", "textStyle": "body" } },
                                        { "id": "p-dev-status", "type": "label", "content": { "text": "Firefox (Linux) не был верифицирован ранее", "textStyle": "caption", "color": "error" } }
                                    ]
                                }
                            ]
                        },
                        { "id": "p-div-2", "type": "divider" },
                        {
                            "id": "policy-sessions", "type": "hStack", "content": { "spacing": "m", "alignment": "center" },
                            "subviews": [
                                { "id": "p-ses-icon", "type": "icon", "content": { "icon": "shieldCheck", "size": "medium", "tint": "accent" } },
                                {
                                    "id": "p-ses-info", "type": "vStack", "content": { "spacing": "xxs" },
                                    "subviews": [
                                        { "id": "p-ses-title", "type": "label", "content": { "text": "Лимит сессий", "textStyle": "body" } },
                                        { "id": "p-ses-status", "type": "label", "content": { "text": "2/5 — в пределах нормы", "textStyle": "caption", "color": "accent" } }
                                    ]
                                }
                            ]
                        }
                    ]
                },
                { "id": "sep-1b", "type": "divider" },
                { "id": "restrictions-header", "type": "label", "content": { "text": "Текущие ограничения", "textStyle": "headline" } },
                {
                    "id": "restrictions-card",
                    "type": "card",
                    "content": { "padding": "m" },
                    "subviews": [
                        {
                            "id": "r1-row", "type": "hStack", "content": { "spacing": "m", "alignment": "center" },
                            "subviews": [
                                { "id": "r1-icon", "type": "icon", "content": { "icon": "lock", "size": "medium", "tint": "error" } },
                                { "id": "r1-label", "type": "label", "content": { "text": "Добавление новых кодов заблокировано", "textStyle": "body" } }
                            ]
                        },
                        { "id": "r-div-1", "type": "divider" },
                        {
                            "id": "r2-row", "type": "hStack", "content": { "spacing": "m", "alignment": "center" },
                            "subviews": [
                                { "id": "r2-icon", "type": "icon", "content": { "icon": "lock", "size": "medium", "tint": "error" } },